{
  "$id": "http://example.com/example.json",
  "type": "object",
  "definitions": {},
  "$schema": "http://json-schema.org/draft-07/schema#",
  "additionalProperties": false,
  "properties": {
    "id": {
      "$ref": "#/definitions/uuidPattern"
    },
    "name": {
      "type": "string"
    },
    "templateName": {
      "type": "string"
    },
    "jurisdiction": {
      "type": "string"
    },
    "rank": {
      "type": "integer"
    },
    "text": {
      "type": "string"
    },
    "welshText": {
      "type": "string"
    },
    "urgentTimeLimit": {
      "type": "number"
    },
    "resultDefinitionLinks": {
      "type": "array",
      "items": {
        "type": "object",
        "required": [],
        "properties": {
          "resultDefinitionId": {
            "$ref": "#/definitions/uuidPattern"
          },
          "mandatory": {
            "type": "boolean"
          },
          "primaryResult": {
            "type": "boolean"
          },
          "sequence": {
            "type": "integer"
          }
        }
      }
    }
  }
}